{
  "schemaVersion": 1,
  "root": "/Users/james/factory-ui-alternatives",
  "targets": [
    {
      "name": "factory",
      "dir": "."
    }
  ],
  "missingApps": [],
  "requestedKinds": [],
  "gates": [
    {
      "name": "ruff check",
      "app": "factory",
      "kind": "lint",
      "status": "pass",
      "exit": 0,
      "durationMs": 905,
      "caveat": null,
      "when": null,
      "outputTail": ""
    },
    {
      "name": "ruff format --check",
      "app": "factory",
      "kind": "format",
      "status": "pass",
      "exit": 0,
      "durationMs": 77,
      "caveat": null,
      "when": null,
      "outputTail": ""
    },
    {
      "name": "mypy",
      "app": "factory",
      "kind": "types",
      "status": "pass",
      "exit": 0,
      "durationMs": 4707,
      "caveat": "mypy reads only the paths in pyproject.toml's `files` and skips dot-directories during discovery. A new top-level directory is silently unchecked while this stays green — add it to `files` in the same change that creates it.",
      "when": null,
      "outputTail": ""
    },
    {
      "name": "pytest",
      "app": "factory",
      "kind": "test",
      "status": "pass",
      "exit": 0,
      "durationMs": 247427,
      "caveat": "Every test here runs against a fake sandbox and fixture transcripts. A green suite proves the control plane's logic, never that `sbx`, `codex`, `gh` or Linear behave the way the fakes say they do — that is what `factory doctor` and a real run are for.",
      "when": null,
      "outputTail": ""
    }
  ],
  "verdict": "pass"
}
